{"$schema":"https://json-schema.org/draft/2020-12/schema","$id":"https://r8-kumamoto-saigai.local/schemas/reconstruction/consultation-item.schema.json","type":"array","items":{"type":"object","additionalProperties":false,"required":["id","programIds","applicationIds","questionKey","affectedPersonPrompt","supporterPrompt","answerType","options","reason","priority","displayOrder","sensitive","canSkip","allowUnknown","allowDecline","sourceLinkIds","unknownHandling","publicationStatus","verificationStatus"],"properties":{"id":{"type":"string","pattern":"^consultation_[a-z0-9_]+$"},"programIds":{"$ref":"common.schema.json#/$defs/idArray"},"applicationIds":{"$ref":"common.schema.json#/$defs/idArray"},"questionKey":{"type":"string","minLength":1},"affectedPersonPrompt":{"type":"string","minLength":1},"supporterPrompt":{"type":"string","minLength":1},"answerType":{"$ref":"common.schema.json#/$defs/answerType"},"options":{"type":"array","items":{"type":"object","required":["value","label"],"properties":{"value":{"type":"string"},"label":{"type":"string"}}}},"reason":{"type":"string"},"priority":{"$ref":"common.schema.json#/$defs/questionPriority"},"displayOrder":{"type":"integer","minimum":1},"sensitive":{"type":"boolean"},"canSkip":{"type":"boolean"},"allowUnknown":{"const":true},"allowDecline":{"const":true},"sourceLinkIds":{"$ref":"common.schema.json#/$defs/idArray"},"unknownHandling":{"type":"string","minLength":1},"publicationStatus":{"$ref":"common.schema.json#/$defs/publicationStatus"},"verificationStatus":{"$ref":"common.schema.json#/$defs/verificationStatus"}}}}
