[
  {
    "id":"consultation_repair_damage_classification",
    "programIds":["program_emergency_housing_repair"],
    "applicationIds":["application_r8_kumamoto_emergency_repair"],
    "questionKey":"housing_damage_classification",
    "affectedPersonPrompt":"り災証明書の住家被害区分は分かりますか？",
    "supporterPrompt":"全壊・大規模半壊・中規模半壊・半壊・準半壊のどれか、公式書類で確認してください。",
    "answerType":"single_choice",
    "options":[{"value":"total","label":"全壊"},{"value":"large_half","label":"大規模半壊"},{"value":"medium_half","label":"中規模半壊"},{"value":"half","label":"半壊"},{"value":"semi_half","label":"準半壊"},{"value":"unknown","label":"分からない"}],
    "reason":"被害区分により対象条件と修理限度額が異なるためです。",
    "priority":"initial",
    "displayOrder":1,
    "sensitive":false,
    "canSkip":true,
    "allowUnknown":true,
    "allowDecline":true,
    "sourceLinkIds":["source_link_application_repair_damage","source_link_application_repair_amount"],
    "unknownHandling":"分からない場合は推測せず、り災証明書を確認するか被災した市町村へ相談します。",
    "publicationStatus":"draft",
    "verificationStatus":"partially_verified"
  },
  {
    "id":"consultation_repair_current_habitability",
    "programIds":["program_emergency_housing_repair"],
    "applicationIds":["application_r8_kumamoto_emergency_repair"],
    "questionKey":"currently_uninhabitable_due_to_essential_damage",
    "affectedPersonPrompt":"日常生活に必要な場所が壊れ、今のままでは住めない状態ですか？",
    "supporterPrompt":"屋根・開口部・配管・衛生設備等の被害により、現状で居住できないかを本人の説明と被害資料で確認してください。",
    "answerType":"yes_no_unknown",
    "options":[{"value":"yes","label":"はい"},{"value":"no","label":"いいえ"},{"value":"unknown","label":"分からない"}],
    "reason":"現状では住めないことが熊本県資料の要件だからです。",
    "priority":"initial",
    "displayOrder":2,
    "sensitive":false,
    "canSkip":true,
    "allowUnknown":true,
    "allowDecline":true,
    "sourceLinkIds":["source_link_application_repair_eligibility","source_link_application_repair_scope"],
    "unknownHandling":"支援者が対象可否を断定せず、被災した市町村へ確認します。",
    "publicationStatus":"draft",
    "verificationStatus":"partially_verified"
  },
  {
    "id":"consultation_repair_expected_habitability_after_repair",
    "programIds":["program_emergency_housing_repair"],
    "applicationIds":["application_r8_kumamoto_emergency_repair"],
    "questionKey":"expected_habitable_after_minimum_repair",
    "affectedPersonPrompt":"必要な部分を修理すれば、その家で再び生活できそうですか？",
    "supporterPrompt":"応急修理により居住可能となる見込みがあるかを確認し、判断は市町村へつないでください。",
    "answerType":"yes_no_unknown",
    "options":[{"value":"yes","label":"はい"},{"value":"no","label":"いいえ"},{"value":"unknown","label":"分からない"}],
    "reason":"修理によって住めるようになる見込みが要件だからです。",
    "priority":"initial",
    "displayOrder":3,
    "sensitive":false,
    "canSkip":true,
    "allowUnknown":true,
    "allowDecline":true,
    "sourceLinkIds":["source_link_application_repair_eligibility"],
    "unknownHandling":"建物の安全性を推測せず、被災した市町村や必要に応じ専門家へ確認します。",
    "publicationStatus":"draft",
    "verificationStatus":"partially_verified"
  }
]
